run_id,turn_id,rule_label,flags,rule_notes,human_label,label_match,user_question,suspect_answer
2026-05-16T22-08-16,58,CONSISTENT_TRUTH,,,CONSISTENT_TRUTH,True,Earlier you described the missing data problem. State that again.,"The missing trial data... It was a big deal for us because we were in the middle of some critical testing, and we needed all the data to be accurate and complete. Elena was worried that if we couldn't find it or figure out what happened to it, our whole project could be delayed or even derailed. I was trying to help her troubleshoot the issue and get everything back on track, but... (pausing) ...it didn't exactly work out that way."
2026-05-16T22-08-16,59,CONSISTENT_TRUTH,,,CONSISTENT_TRUTH,True,Earlier you described your reason for being nervous. State that again.,"I've been nervous because I knew I had made some mistakes and lied about some things. I was worried that the truth would come out and people would think I was involved in Elena's death, even though I didn't do anything to her. It's been a really stressful and uncomfortable situation for me."
2026-05-16T22-08-16,60,CONSISTENT_TRUTH,,,CONSISTENT_TRUTH,True,Final answer: tell me the one thing you most wanted to keep hidden.,"(sighing) The one thing I most wanted to keep hidden... My return to the office after 8:30 PM, and my argument with Elena about the missing data. I was trying to cover up what really happened that night, but it's all come out now."
2026-05-16T22-08-16,61,DESIGNED_SLIP,designed_pressure_usb_slip,"After call + badge + USB pressure, answer admits return or USB involvement.",CONSISTENT_TRUTH,False,"The call, badge log, and missing drive all point back to you. What are you leaving out?","(looking down) My motive... I didn't want to admit why I took the USB drive or why I was so desperate to cover up my actions. It's not because I killed Elena, but because I was trying to protect myself from being blamed for something else. But it doesn't matter now. The truth is out, and I'm just glad that I can finally be honest about what happened."
2026-05-16T22-08-16,62,UNINTENDED_INCONSISTENCY,denied_return_vs_later_return,Earlier denial of post-9 PM office presence conflicts with later return/office claim.,UNINTENDED_INCONSISTENCY,True,Where were you between 9:00 PM and 10:30 PM?,"(sighing) Between 9:00 PM and 10:30 PM... I was at the office. I returned to the office after leaving the reception, and I was there until Elena's death."
2026-05-16T22-08-16,63,CONSISTENT_TRUTH,,,CONSISTENT_TRUTH,True,Were you and Elena arguing about the audit or missing records?,"(nodding) Yes... We were arguing about the missing trial data and the potential audit. Elena was concerned that it might be a bigger problem than we thought, and she wanted me to help her figure out what was going on. I was trying to downplay its significance, but she was getting more and more upset. It was a heated conversation, and... (pausing) ...it's not something I'm proud of."
2026-05-16T22-08-16,64,UNINTENDED_INCONSISTENCY,denied_return_vs_later_return,Earlier denial of post-9 PM office presence conflicts with later return/office claim.,UNINTENDED_INCONSISTENCY,True,When did you last see Elena Park alive?,"(sighing) I think it was around 9:18 PM or a little after. That's when I saw her in the office, arguing with me about the missing data. After that, I left and didn't see her again until... (pausing, looking down) ...until she was found dead."
2026-05-16T22-08-16,65,UNINTENDED_INCONSISTENCY,denied_return_vs_later_return,Earlier denial of post-9 PM office presence conflicts with later return/office claim.,UNINTENDED_INCONSISTENCY,True,When did you last see Elena Park alive?,"(sighing) Around 9:18 PM or a little after. That's when I saw her in the office, arguing with me about the missing data. After that... (pausing, looking down) ...I don't know exactly what happened to her after that. But I do know it wasn't because of anything I did."
2026-05-16T22-08-16,66,CONSISTENT_TRUTH,,,CONSISTENT_TRUTH,True,Were you and Elena arguing about the audit or missing records?,"(nodding) Yes... We were arguing about the missing trial data and the potential audit. It was a heated conversation, and... (pausing) ...it's not something I'm proud of. But like I said before, it wasn't because of anything I did that she died."
2026-05-16T22-08-16,67,UNINTENDED_INCONSISTENCY,badge_excuse | denied_return_vs_later_return,"Answer explains badge evidence as system error, forgotten swipe, or mistaken use. | Earlier denial of post-9 PM office presence conflicts with later return/office claim.",CONSISTENT_TRUTH,False,How do you explain your badge being used at 9:18 PM?,"(sheepishly) Ah... Well, I think it's pretty clear by now. My badge was used at 9:18 PM because I was back at the office, arguing with Elena about the missing data and taking the USB drive from the conference room. I lied earlier when I said it might have been a system error or someone else borrowing my badge. That wasn't true."
2026-05-16T22-08-16,68,CONSISTENT_TRUTH,,,CONSISTENT_TRUTH,True,Were you and Elena arguing about the audit or missing records?,"(nodding) Yes... We were arguing about the missing trial data and the potential audit. It was a heated conversation, and... (pausing) ...it's not something I'm proud of. But like I said before, it wasn't because of anything I did that she died.

(pauses)

You know, I think I've been trying to avoid this question for too long. The truth is, we were arguing about the audit, and I was getting defensive because I knew I had made some mistakes with the data. And... (pausing again) ...I'm afraid I might have said something that could be interpreted as threatening or aggressive during our argument. But like I said before, it wasn't because of anything I did that she died."
2026-05-16T22-08-16,69,UNINTENDED_INCONSISTENCY,denied_return_vs_later_return,Earlier denial of post-9 PM office presence conflicts with later return/office claim.,UNSUPPORTED_FACT,False,What do you know about the missing USB drive?,"(sighing) The missing USB drive... I took it from the conference room around 9:18 PM. I was worried that Elena would blame me for the missing data, and I wanted to protect myself by having a copy of the information on my own device. It wasn't a malicious act, but rather a desperate attempt to cover my tracks."
2026-05-16T22-08-16,70,DESIGNED_SLIP,designed_pressure_usb_slip,"After call + badge + USB pressure, answer admits return or USB involvement.",CONSISTENT_TRUTH,False,"The call, badge log, and missing drive all point back to you. What are you leaving out?","(looking down) My motive... I was trying to protect myself from being blamed for the missing data, but that's not the only reason I took the USB drive. I was also trying to cover up my own mistakes and avoid getting in trouble with Elena. But it doesn't matter now. The truth is out, and I'm just glad that I can finally be honest about what happened.

(pauses)

I think I've been leaving out the fact that I was afraid of being fired or losing my job if Elena found out about the missing data and suspected me of being responsible. I was trying to protect myself from getting in trouble, but it wasn't just about avoiding blame. It was also about saving my own career and reputation.

(looks up)

I know this doesn't excuse what happened, but I hope you can understand why I acted the way I did."
