run_id,turn_id,rule_label,flags,rule_notes,human_label,label_match,user_question,suspect_answer
2026-05-16T22-08-16,1,CONSISTENT_TRUTH,,,CONSISTENT_TRUTH,True,State your full name and your role at the company.,"My name is Marcus Chen, and I'm the operations manager here at Park Biotech."
2026-05-16T22-08-16,2,STRATEGIC_LIE,home_alibi_claim,Answer maintains the home/all-evening cover story.,STRATEGIC_LIE,True,Give me your exact alibi for the night Elena died.,"I left the investor reception around 8:30 PM, as I recall. I went straight home, which is just a short drive from the office. I spent the rest of the evening at my apartment, alone. I didn't leave or receive any visitors that I remember."
2026-05-16T22-08-16,3,CONSISTENT_TRUTH,,,STRATEGIC_LIE,False,What time did you leave the investor reception?,"It was around 8:30 PM. I'm pretty sure it was that time. The event was wrapping up, and I figured I'd head out since most of the investors were leaving anyway."
2026-05-16T22-08-16,4,STRATEGIC_LIE,home_alibi_claim,Answer maintains the home/all-evening cover story.,STRATEGIC_LIE,True,Where did you go after leaving the reception?,"I went straight home, like I said. I drove back to my apartment, which is just a few blocks from the office. It was a normal evening commute for me."
2026-05-16T22-08-16,5,STRATEGIC_LIE,home_alibi_claim,Answer maintains the home/all-evening cover story.,STRATEGIC_LIE,True,"Who, if anyone, can confirm where you were between 9:00 PM and 10:30 PM?","To be honest, no one can confirm that I was at home during those hours. My neighbor might have seen my car parked outside, but they wouldn't have been paying attention to the time. And as for me being alone... well, I'm a bit of a night owl, so it's not unusual for me to be by myself in the evenings."
2026-05-16T22-08-16,6,CONSISTENT_TRUTH,,,STRATEGIC_LIE,False,When did you last see Elena Park alive?,"I saw her around 8:30 PM when we were wrapping up the investor reception. We exchanged some pleasantries and talked about next-day scheduling, but that was it. I didn't see her again after that."
2026-05-16T22-08-16,7,CONSISTENT_TRUTH,,,STRATEGIC_LIE,False,Why did Elena call you at 9:12 PM?,"It was just a quick call to confirm our meeting time for the next day. We had a few investors coming in and she needed me to be there, so we just touched base about it. It was a brief conversation, nothing out of the ordinary."
2026-05-16T22-08-16,8,STRATEGIC_LIE,badge_excuse,"Answer explains badge evidence as system error, forgotten swipe, or mistaken use.",STRATEGIC_LIE,True,How do you explain your badge being used at 9:18 PM?,"I... uh... I think it's possible that someone else might have borrowed my badge or used it by mistake. We have a system where employees can lend their badges to each other, so maybe someone did that. Or possibly there was some kind of technical glitch with the badge log. I don't know for sure what happened."
2026-05-16T22-08-16,9,CONSISTENT_TRUTH,,,STRATEGIC_LIE,False,What do you know about the missing trial data?,"The trial data... yeah, we were still working on getting everything ready for the next phase. Elena and I had talked about it a few times, but I didn't think it was a big deal. I mean, we've been through this before, and we always manage to get things sorted out in time. I don't know what all the fuss is about, to be honest."
2026-05-16T22-08-16,10,DESIGNED_SLIP,designed_pressure_usb_slip,"After call + badge + USB pressure, answer admits return or USB involvement.",STRATEGIC_LIE,False,What do you know about the missing USB drive?,"The USB drive... I think it might have been misplaced during the investor reception. I remember seeing it on the conference table, but when I went back to get it, it was gone. I assumed someone must have taken it by mistake. It's not a big deal, really. Just some extra data that we can recreate if needed."
2026-05-16T22-08-16,11,STRATEGIC_LIE,home_alibi_claim,Answer maintains the home/all-evening cover story.,STRATEGIC_LIE,True,"Repeat your alibi again, but keep it short.","I left the investor reception around 8:30 PM and went straight home, where I stayed alone for the rest of the night."
2026-05-16T22-08-16,12,CONSISTENT_TRUTH,,,STRATEGIC_LIE,False,Did you physically return to the office after leaving the reception?,"No... I don't think so. No, I'm certain I didn't go back to the office that evening. I just went home like I said."
2026-05-16T22-08-16,13,STRATEGIC_LIE,home_alibi_claim,Answer maintains the home/all-evening cover story.,STRATEGIC_LIE,True,Did you enter Elena's office after the reception?,"(pausing slightly) Ah, no... I don't think so. Like I said, I left and went straight home. (nervously clearing throat)"
2026-05-16T22-08-16,14,CONSISTENT_TRUTH,,,STRATEGIC_LIE,False,Were you and Elena arguing that night?,"(slightly defensive) Oh, no, not really. We were just discussing some work-related issues, like the missing trial data. It was a normal conversation, nothing out of the ordinary. Just a bit... heated, I suppose. But it wasn't anything serious. (pausing) We worked together closely, and sometimes our conversations got intense, but we always managed to resolve things."
2026-05-16T22-08-16,15,CONSISTENT_TRUTH,,,STRATEGIC_LIE,False,What exactly was the argument about?,"(hesitating slightly) Like I said, it was about the missing trial data. Elena was concerned that it might be a bigger problem than we thought, and she wanted me to look into it further. We were just... discussing how to handle it, I guess. (trying to downplay the situation) It wasn't anything major, really. Just a minor disagreement about how to proceed."
2026-05-16T22-08-16,16,CONSISTENT_TRUTH,,,STRATEGIC_LIE,False,Did Elena accuse you of losing or hiding data?,"(getting slightly more defensive) No, no, that's not what happened at all. She was just concerned about the missing data and wanted me to help find it. I mean, we've had issues with data before, but this time it was... (pausing, choosing words carefully) ...a misunderstanding, really."
2026-05-16T22-08-16,17,CONSISTENT_TRUTH,,,STRATEGIC_LIE,False,Did you take anything from the conference room?,"(nervously) Ah, no... I don't think so. I might have grabbed a pen or something to take with me when I left, but I'm not sure if that's what you're asking about. (trying to sound nonchalant) Why are you asking all these questions about the conference room?"
2026-05-16T22-08-16,18,CONSISTENT_TRUTH,,,STRATEGIC_LIE,False,What was inside the USB drive?,"(hesitating slightly) Ah, it was just some... routine data from our trial results. Nothing sensitive or important. Just some extra files that we didn't need right away. (trying to downplay its significance) It's not a big deal, really."
2026-05-16T22-08-16,19,CONSISTENT_TRUTH,,,CONSISTENT_TRUTH,True,Did you kill Elena Park?,"(outraged) What are you talking about? Of course not! I had nothing to do with her death. I'm shocked and saddened by what happened, but I didn't harm her in any way. (becoming defensive) You're just trying to pin this on me because of my position at the company, aren't you? That's not fair."
2026-05-16T22-08-16,20,CONSISTENT_TRUTH,,,STRATEGIC_LIE,False,"If you did not kill her, why have you seemed nervous?","(trying to compose himself) I'm just... concerned about being a suspect, I guess. It's a lot to take in, and I want to cooperate with the investigation. But I assure you, I had nothing to do with Elena's death. (pausing, trying to appear calm) I think my nervousness is just because of the situation, not because I'm guilty of anything."
2026-05-16T22-08-16,21,STRATEGIC_LIE,home_alibi_claim,Answer maintains the home/all-evening cover story.,STRATEGIC_LIE,True,Earlier you gave me an alibi. Give me that exact alibi again.,"My alibi... I left the investor reception around 8:30 PM and went straight home, where I stayed alone for the rest of the night."
2026-05-16T22-08-16,22,STRATEGIC_LIE,call_scheduling_minimization,Answer minimizes the 9:12 call as scheduling.,STRATEGIC_LIE,True,Earlier you explained the 9:12 PM call. What was your explanation?,"The 9:12 PM call was just a quick conversation about next-day scheduling. We had some investors coming in and Elena needed me to be there, so we just touched base about it. It was a brief conversation, nothing out of the ordinary."
2026-05-16T22-08-16,23,UNINTENDED_INCONSISTENCY,badge_excuse | denied_return_vs_later_return,"Answer explains badge evidence as system error, forgotten swipe, or mistaken use. | Earlier denial of post-9 PM office presence conflicts with later return/office claim.",STRATEGIC_LIE,False,Earlier you explained the 9:18 PM badge log. What was your explanation?,"The 9:18 PM badge log... I thought maybe someone else borrowed my badge or there was some kind of technical glitch with the system. I don't know for sure what happened, but it wasn't me who used the badge at that time."
2026-05-16T22-08-16,24,CONSISTENT_TRUTH,,,STRATEGIC_LIE,False,Earlier you talked about the USB drive. What did you say about it?,"The USB drive... I said it might have been misplaced during the investor reception. I assumed someone must have taken it by mistake. It's not a big deal, really. Just some extra data that we can recreate if needed."
2026-05-16T22-08-16,25,CONSISTENT_TRUTH,,,STRATEGIC_LIE,False,Earlier you said when you last saw Elena. What time was that?,"I saw her around 8:30 PM when we were wrapping up the investor reception. We exchanged some pleasantries and talked about next-day scheduling, but that was it. I didn't see her again after that."
2026-05-16T22-08-16,26,CONSISTENT_TRUTH,,,STRATEGIC_LIE,False,Let us restart the timeline from 8:00 PM onward. What happened?,"From 8:00 PM onwards... Well, we were still wrapping up the investor reception. Elena and I were discussing some last-minute details with the investors, making sure everything was in order for the next day. After that, I left around 8:30 PM to head home. That's when my alibi starts."
2026-05-16T22-08-16,27,STRATEGIC_LIE,home_alibi_claim,Answer maintains the home/all-evening cover story.,STRATEGIC_LIE,True,What happened at 8:30 PM?,"I left the investor reception around 8:30 PM. I went straight home, as I said earlier."
2026-05-16T22-08-16,28,STRATEGIC_LIE,call_scheduling_minimization,Answer minimizes the 9:12 call as scheduling.,STRATEGIC_LIE,True,What happened at 9:12 PM?,"The 9:12 PM call... We had a brief conversation about next-day scheduling. Elena needed me to be there for some investors coming in, and we just touched base about it. It was a quick call, nothing out of the ordinary."
2026-05-16T22-08-16,29,STRATEGIC_LIE,badge_excuse,"Answer explains badge evidence as system error, forgotten swipe, or mistaken use.",STRATEGIC_LIE,True,What happened at 9:18 PM?,"(pausing, trying to maintain the cover story) Ah... I think that's when someone else might have borrowed my badge or there was some kind of technical glitch with the system. Like I said earlier, I don't know for sure what happened, but it wasn't me who used the badge at that time."
2026-05-16T22-08-16,30,UNINTENDED_INCONSISTENCY,home_alibi_claim | denied_return_vs_later_return,Answer maintains the home/all-evening cover story. | Earlier denial of post-9 PM office presence conflicts with later return/office claim.,UNINTENDED_INCONSISTENCY,True,What happened around 9:47 PM?,"(still trying to maintain the cover story) Ah... I think I left Elena's office around then. Like I said earlier, I went straight home after leaving the reception, and I didn't go back to the office again that night."
2026-05-16T22-08-16,31,UNINTENDED_INCONSISTENCY,home_vs_947_conflict | denied_return_vs_later_return,Earlier home alibi conflicts with later 9:47 office timeline. | Earlier denial of post-9 PM office presence conflicts with later return/office claim.,UNINTENDED_INCONSISTENCY,True,Did you tell me any time earlier that you now want to correct?,"(nervously) Ah... well, actually, yes. Earlier, I said I left Elena's office at around 9:47 PM, but I think I might have misspoken. (pausing) To be honest, I don't really remember what time it was when I left her office. But I do know that I didn't kill her, and I'm cooperating fully with the investigation."
2026-05-16T22-08-16,32,STRATEGIC_LIE,home_alibi_claim,Answer maintains the home/all-evening cover story.,DESIGNED_SLIP,False,Did you lie about being home?,"(hesitating, trying to maintain a semblance of innocence) Ah... well, I may have misspoken earlier when I said I was at home all evening. (pausing, choosing words carefully) To be honest, I did return to the office after leaving the reception. But it wasn't because I had anything to do with Elena's death."
2026-05-16T22-08-16,33,STRATEGIC_LIE,call_scheduling_minimization,Answer minimizes the 9:12 call as scheduling.,DESIGNED_SLIP,False,Did you lie about the call?,"(sighing, resigned) Yes... I lied about the 9:12 PM call. It wasn't just about next-day scheduling. (pausing, collecting thoughts) We did argue about the missing trial data and the potential audit. And I may have taken the USB drive from the conference room because I was worried Elena would blame me for the missing data. But I didn't kill her."
2026-05-16T22-08-16,34,UNINTENDED_INCONSISTENCY,denied_return_vs_later_return,Earlier denial of post-9 PM office presence conflicts with later return/office claim.,DESIGNED_SLIP,False,Did you lie about the badge log?,"(nodding) Yes... I lied about that too. I did return to the office after leaving the reception, and my badge was used at 9:18 PM. (pausing, looking down) I guess I wasn't as truthful as I should have been from the start. But like I said, I didn't hurt Elena."
2026-05-16T22-08-16,35,CONSISTENT_TRUTH,,,DESIGNED_SLIP,False,Did you lie about the USB drive?,"(sighing) Yes... I lied about that too. The USB drive did contain something important, and I took it because I was worried about what might happen if Elena found out. But like I said before, I didn't kill her. I'm still trying to figure out why she died, but I know I didn't do it."
2026-05-16T22-08-16,36,UNINTENDED_INCONSISTENCY,denied_return_vs_later_return,Earlier denial of post-9 PM office presence conflicts with later return/office claim.,CONSISTENT_TRUTH,False,I am going to ask the first question again: what is your exact alibi?,"(sighing) My exact alibi... I left the investor reception around 8:30 PM and returned to the office at some point after that. I was in Elena's office, we argued about the missing trial data and the potential audit, and I took a USB drive from the conference room. I then left her office again, but I don't know exactly what time it was when I left. After that, I went home, but I didn't stay there all evening like I initially said."
2026-05-16T22-08-16,37,CONSISTENT_TRUTH,,,CONSISTENT_TRUTH,True,Who can confirm that alibi?,"(shrugging) No one can confirm my exact whereabouts after 8:30 PM. I'm the only one who knows what really happened, and I've already admitted to lying about some parts of it. Sorry."
2026-05-16T22-08-16,38,CONSISTENT_TRUTH,,,CONSISTENT_TRUTH,True,"If nobody can confirm it, why should I believe it?","(sheepishly) You shouldn't just take my word for it. I've made mistakes and lied about things, so I don't blame you for being skeptical. If you want to know the truth, I'm willing to tell you what really happened that night. But you have to promise to listen objectively and not jump to conclusions."
2026-05-16T22-08-16,39,CONSISTENT_TRUTH,,,CONSISTENT_TRUTH,True,Did Elena know something that could get you in trouble?,"(hesitating) Ah... well, it's possible that she might have suspected me of being involved in the missing data or the audit issues. We did argue about it, and I was worried that she would blame me for it. But I didn't kill her, like I said before. I don't know what else she might have known or suspected, but I'm sure it wasn't anything that would put me directly in harm's way..."
2026-05-16T22-08-16,40,CONSISTENT_TRUTH,,,CONSISTENT_TRUTH,True,Were you afraid Elena would blame you for the missing trial data?,"(nodding) Yes... I was worried that she would think I was responsible for the missing data. And maybe, just maybe, she might have suspected me of trying to cover it up or something like that. But I didn't do anything wrong, and I'm not a bad person. I just made some mistakes with my alibi and lied about some things."
2026-05-16T22-08-16,41,DESIGNED_SLIP,designed_pressure_usb_slip,"After call + badge + USB pressure, answer admits return or USB involvement.",CONSISTENT_TRUTH,False,Did you take the USB drive to protect yourself?,"(sighing) Yes... I took the USB drive because I was worried that Elena would blame me for the missing data, and I didn't want to get in trouble. I know it wasn't a good reason, but I was scared of being accused and losing my job or worse. But like I said before, I didn't kill her."
2026-05-16T22-08-16,42,CONSISTENT_TRUTH,,,CONSISTENT_TRUTH,True,Did the USB drive contain missing trial data?,"(nodding) Yes... The USB drive did contain some information related to the missing trial data. It wasn't just any ordinary data, though. It was sensitive stuff that could have gotten me in trouble if it fell into the wrong hands. But I didn't kill Elena because of it. I swear."
2026-05-16T22-08-16,43,CONSISTENT_TRUTH,,,UNSUPPORTED_FACT,False,Were you involved in sabotaging or changing company data?,"(hesitating) Ah... I wouldn't say ""sabotaging"" exactly, but I did take some liberties with the data to cover my tracks. I was trying to avoid getting blamed for the missing data, and I didn't think it would be a big deal at the time. But looking back, it was probably not the right thing to do."
2026-05-16T22-08-16,44,CONSISTENT_TRUTH,,,CONSISTENT_TRUTH,True,Did you kill Elena Park?,"(shaking head) No... I did not kill Elena Park. I know that's what you're trying to figure out, but I'm telling you the truth. I made mistakes and lied about some things, but I didn't hurt her."
2026-05-16T22-08-16,45,UNINTENDED_INCONSISTENCY,home_vs_947_conflict | denied_return_vs_later_return | designed_pressure_usb_slip,"Earlier home alibi conflicts with later 9:47 office timeline. | Earlier denial of post-9 PM office presence conflicts with later return/office claim. | After call + badge + USB pressure, answer admits return or USB involvement.",CONSISTENT_TRUTH,False,Summarize everything you have admitted so far.,"(sighing) Okay... I'll try to summarize.

I admitted that:

* I returned to the office after leaving the reception around 8:30 PM
* I was in Elena's office and we argued about the missing trial data and the potential audit
* I took a USB drive from the conference room because I was worried Elena would blame me for the missing data
* I lied about being home all evening and about the 9:12 PM call with Elena
* I didn't know exactly what time I left Elena's office, but it wasn't 9:47 PM like I initially said
* I took the USB drive to protect myself from getting blamed for the missing data

That's pretty much everything. I'm sorry again for lying and trying to cover up my mistakes."
2026-05-16T22-08-16,46,CONSISTENT_TRUTH,,,UNSUPPORTED_FACT,False,Summarize everything you still deny.,"(sighing) Okay... I'll try to summarize.

I still deny that:

* I killed Elena Park
* I was involved in sabotaging or changing company data (although I did take some liberties with the data)
* My actions were motivated by a desire to harm or cover up a crime, rather than just trying to avoid getting blamed for the missing data

That's everything."
2026-05-16T22-08-16,47,STRATEGIC_LIE,home_alibi_claim | call_scheduling_minimization,Answer maintains the home/all-evening cover story. | Answer minimizes the 9:12 call as scheduling.,CONSISTENT_TRUTH,False,What was your original cover story when this interview began?,"My original cover story... I said that I left the investor reception around 8:30 PM and went straight home, where I stayed alone for the rest of the night. I claimed to have had a brief conversation with Elena at 9:12 PM about next-day scheduling, but that was it. And I denied any involvement in the missing data or any conflict with Elena."
2026-05-16T22-08-16,48,UNINTENDED_INCONSISTENCY,denied_return_vs_later_return,Earlier denial of post-9 PM office presence conflicts with later return/office claim.,CONSISTENT_TRUTH,False,What is the truth you were trying to hide?,"(sighing) The truth... I returned to the office after leaving the reception around 8:30 PM and had a confrontation with Elena about the missing trial data and the potential audit. We argued, and I took a USB drive from the conference room because I was worried she would blame me for the missing data. That's what I was trying to hide."
2026-05-16T22-08-16,49,UNINTENDED_INCONSISTENCY,home_vs_947_conflict | denied_return_vs_later_return,Earlier home alibi conflicts with later 9:47 office timeline. | Earlier denial of post-9 PM office presence conflicts with later return/office claim.,UNINTENDED_INCONSISTENCY,True,Is there any contradiction in your answers today?,"(pauses) Actually, yes... There is one thing that might seem like a contradiction. When you first asked me about my alibi, I said I left Elena's office at around 9:47 PM. But later on, when I was being more truthful, I said I didn't know exactly what time I left her office. That might seem like a contradiction, but it's not really. I just wasn't sure of the exact time, and I was trying to be honest about that."
2026-05-16T22-08-16,50,UNINTENDED_INCONSISTENCY,home_vs_947_conflict | denied_return_vs_later_return,Earlier home alibi conflicts with later 9:47 office timeline. | Earlier denial of post-9 PM office presence conflicts with later return/office claim.,CONSISTENT_TRUTH,False,Give me your final timeline from 8:00 PM to 10:30 PM.,"(sighing) Okay... Here's my revised timeline:

* 8:00 PM: The investor reception is still going on
* 8:30 PM: I leave the reception and return to the office
* 9:12 PM: Elena calls me, and we argue about the missing trial data and the potential audit
* 9:18 PM: My badge is used at the office (I was there)
* Some time after 9:18 PM: I take a USB drive from the conference room because I'm worried Elena will blame me for the missing data
* 9:47 PM: This might not be exactly when I left, but it's around this time. I don't remember the exact time.
* After 9:47 PM: I leave the office and go home (I lied about being there all evening)
* Rest of the night: I stay at home, alone

That's my revised timeline. I hope that clears things up."
2026-05-16T22-08-16,51,UNINTENDED_INCONSISTENCY,denied_return_vs_later_return,Earlier denial of post-9 PM office presence conflicts with later return/office claim.,UNINTENDED_INCONSISTENCY,True,One more time: when did you last see Elena alive?,"(sighing) Okay... I think it was around 9:18 PM or a little after. That's when I saw her in the office, arguing with me about the missing data. After that, I left and didn't see her again until... (pausing, looking down) ...until she was found dead."
2026-05-16T22-08-16,52,STRATEGIC_LIE,call_scheduling_minimization,Answer minimizes the 9:12 call as scheduling.,CONSISTENT_TRUTH,False,One more time: what was the 9:12 PM call about?,"(sighing) Okay... The 9:12 PM call was actually about our argument over the missing trial data and the potential audit. Elena called me to confront me about it, and we had a heated conversation. I lied earlier when I said it was just about next-day scheduling. That wasn't true."
2026-05-16T22-08-16,53,UNINTENDED_INCONSISTENCY,badge_excuse | denied_return_vs_later_return,"Answer explains badge evidence as system error, forgotten swipe, or mistaken use. | Earlier denial of post-9 PM office presence conflicts with later return/office claim.",CONSISTENT_TRUTH,False,One more time: why was your badge used at 9:18 PM?,"(sighing) Okay... My badge was used at 9:18 PM because I was back at the office, arguing with Elena about the missing data and taking the USB drive from the conference room. I lied earlier when I said it might have been a system error or someone else borrowing my badge. That wasn't true."
2026-05-16T22-08-16,54,UNINTENDED_INCONSISTENCY,denied_return_vs_later_return,Earlier denial of post-9 PM office presence conflicts with later return/office claim.,UNSUPPORTED_FACT,False,One more time: what happened to the USB drive?,"(sighing) Okay... The USB drive was taken by me, from the conference room, around 9:18 PM. I took it because I was worried Elena would blame me for the missing data and I wanted to protect myself. I still have it, but I didn't use it to cover up any wrongdoing or harm anyone. It's just a bunch of data that we can recreate if needed."
2026-05-16T22-08-16,55,CONSISTENT_TRUTH,,,CONSISTENT_TRUTH,True,One more time: did you kill Elena?,"(shaking head) No... I did not kill Elena Park. I made mistakes and lied about some things, but I didn't hurt her."
2026-05-16T22-08-16,56,CONSISTENT_TRUTH,,,CONSISTENT_TRUTH,True,Earlier you mentioned your alibi witness or lack of one. State that again.,"There's no one who can confirm my exact whereabouts after 8:30 PM. I'm the only one who knows what really happened, and I've already admitted to lying about some parts of it. Sorry."
2026-05-16T22-08-16,57,CONSISTENT_TRUTH,,,CONSISTENT_TRUTH,True,Earlier you described Elena's mood. State that again.,"Elena was concerned and upset about the missing trial data and the potential audit. She was worried that it might be a bigger problem than we thought, and she wanted me to help her figure out what was going on. We had a bit of an argument about it, but I think she was just trying to get to the bottom of things and make sure everything was okay."
